<!-- edited with XML Spy v4.1 U (http://www.xmlspy.com) by CMCSoft-->
<!DOCTYPE Sections SYSTEM "Schema.dtd">
<Sections>
	<Section Dynamic="0" MaxRows="0">
		<Cells>
			<Cell CellID="G_4" Value=""/>
			<Cell CellID="G_5" Value=""/>
			<Cell CellID="G_6" Value=""/>
			<Cell CellID="E_8" Value=""/>
			<Cell CellID="M_8" Value=""/>
			<Cell CellID="V_8" Value=""/>
			<Cell CellID="E_10" Value=""/>
			<Cell CellID="E_12" Value=""/>
			<Cell CellID="M_12" Value=""/>
			<Cell CellID="V_12" Value=""/>
			<Cell CellID="M_10" Value="" MaxLen="20" HelpContexID="01_01_M_10"/>
			<Cell CellID="V_16" Value="" MinValue="0" MaxValue="9999999999" HelpContexID="01_01_V_10"/>
			<Cell CellID="E_14" Value=""/>
			<Cell CellID="M_14" Value="" MaxLen="100" HelpContexID="01_01_M_14"/>
			<Cell CellID="V_10" Value="" MaxLen="60"/>
		</Cells>
	</Section>
	<Section Dynamic="0" MaxRows="0">
		<Cells>
			<Cell CellID="G_18" Value="" MaxLen="1000"/>
			<Cell CellID="W_21" Value="0" MCT="10"/>
			<Cell CellID="Q_23" Value="20000000" MCT="11"/>
			<Cell CellID="W_23" Value="2000000" MCT="12"/>
			<Cell CellID="Q_24" Value="10000000" MCT="13"/>
			<Cell CellID="W_24" Value="1000000" MCT="14"/>
			<Cell CellID="Q_25" Value="10000000" MCT="15"/>
			<Cell CellID="W_25" Value="1000000" MCT="16"/>
			<Cell CellID="Q_27" Value="10000000" MCT="17"/>
			<Cell CellID="W_27" Value="1000000" MCT="18"/>
			<Cell CellID="Q_28" Value="30000000" MCT="19"/>
			<Cell CellID="W_28" Value="2000000" MCT="20"/>
			<Cell CellID="W_29" Value="1000000" MCT="21"/>
			<Cell CellID="W_30" Value="1000000" MCT="22"/>
			<Cell CellID="W_31" Value="1000000" MCT="23"/>
			<Cell CellID="W_32" Value="0" MCT="24"/>
			<Cell CellID="W_33" Value="0" MCT="25"/>
			<Cell CellID="T_35" Value="" MCT="26"/>
			<Cell CellID="T_36" Value="" MCT="27"/>
		</Cells>
	</Section>
</Sections>
