<!-- edited with XML Spy v4.1 U (http://www.xmlspy.com) by CMCSoft-->
<!DOCTYPE Sections SYSTEM "Schema.dtd">
<Sections>
	<Section Dynamic="0" MaxRows="0">
		<Cells>
			<Cell CellID="G_4" Value=""/>
			<Cell CellID="G_5" Value=""/>
			<Cell CellID="G_6" Value=""/>
			<Cell CellID="E_8" Value=""/>
			<Cell CellID="M_8" Value=""/>
			<Cell CellID="V_8" Value=""/>
			<Cell CellID="E_10" Value=""/>
			<Cell CellID="E_12" Value=""/>
			<Cell CellID="M_12" Value=""/>
			<Cell CellID="V_12" Value=""/>
			<Cell CellID="M_10" Value="" MaxLen="20" HelpContexID="01_01_M_10"/>
			<Cell CellID="V_16" Value="" MinValue="0" MaxValue="9999999999" HelpContexID="01_01_V_10"/>
			<Cell CellID="E_14" Value=""/>
			<Cell CellID="M_14" Value="" MaxLen="100" HelpContexID="01_01_M_14"/>
			<Cell CellID="V_10" Value="" MaxLen="60"/>
		</Cells>
	</Section>
	<Section Dynamic="1" MaxRows="0">
		<Cells>
			<Cell CellID="C_25" FirstCell="0" Value="fdgd" MCT="2"/>
			<Cell CellID="D_25" Value="2" MCT="3"/>
			<Cell CellID="E_25" Value="01/01/2010" MCT="4"/>
			<Cell CellID="F_25" Value="fdgf" MCT="5"/>
			<Cell CellID="I_25" Value="10101" MCT="6"/>
			<Cell CellID="J_25" Value="fsdfsd" MCT="7"/>
			<Cell CellID="N_25" Value="100.00" MCT="8"/>
			<Cell CellID="O_25" Value="100000.00" MCT="9"/>
			<Cell CellID="P_25" Value="10000000" MCT="10"/>
		</Cells>
	</Section>
	<Section Dynamic="1" MaxRows="0">
		<Cells>
			<Cell CellID="L_29" FirstCell="0" Value="Xì gà" MCT="11"/>
			<Cell CellID="N_29" Value="100.00"/>
			<Cell CellID="P_29" Value="10000000"/>
		</Cells>
	</Section>
</Sections>
