<!-- Edited by htphuong FIS_CMC-->
<!DOCTYPE Sections SYSTEM "Schema.dtd">
<Sections>
	<Section Dynamic="0" MaxRows="0">
		<Cells>
			<Cell CellID="G_4" Value=""/>
			<Cell CellID="G_5" Value=""/>
			<Cell CellID="G_6" Value=""/>
			<Cell CellID="E_8" Value=""/>
			<Cell CellID="M_8" Value=""/>
			<Cell CellID="V_8" Value=""/>
			<Cell CellID="E_10" Value=""/>
			<Cell CellID="E_12" Value=""/>
			<Cell CellID="M_12" Value=""/>
			<Cell CellID="V_12" Value=""/>
			<Cell CellID="M_10" Value="" MaxLen="20" HelpContexID="01_01_M_10"/>
			<Cell CellID="V_16" Value="" MinValue="0" MaxValue="9999999999" HelpContexID="01_01_V_10"/>
			<Cell CellID="E_14" Value=""/>
			<Cell CellID="M_14" Value="" MaxLen="100" HelpContexID="01_01_M_14"/>
			<Cell CellID="V_10" Value="" MaxLen="60"/>
			<Cell CellID="E_36" Value=""/>
		</Cells>
	</Section>
	<Section Dynamic="0" MaxRows="0">
		<Cells>
			<Cell CellID="U_40" Value="100000" MCT="1"/>
			<Cell CellID="U_41" Value="10000000" MCT="2"/>
			<Cell CellID="U_42" Value="50000" MCT="3"/>
			<Cell CellID="U_43" Value="8000000" MCT="4"/>
			<Cell CellID="U_44" Value="200" MCT="5"/>
			<Cell CellID="U_45" Value="100000" MCT="6"/>
			<Cell CellID="U_49" Value="20" MCT="7"/>
			<Cell CellID="U_50" Value="10" MCT="8"/>
			<Cell CellID="U_51" Value="10" MCT="9"/>
			<Cell CellID="U_52" Value="90000000" MCT="10"/>
			<Cell CellID="U_53" Value="50000000" MCT="11"/>
			<Cell CellID="U_54" Value="40000000" MCT="12"/>
			<Cell CellID="U_55" Value="13000000" MCT="13"/>
			<Cell CellID="U_56" Value="5000000" MCT="14"/>
			<Cell CellID="U_57" Value="8000000" MCT="15"/>
		</Cells>
	</Section>
	<Section Dynamic="0" MaxRows="0">
		<Cells>
			<Cell CellID="R_59" Value="Hà Thế Phương"/>
			<Cell CellID="R_61" Value="13/02/2009"/>
			<Cell CellID="C_62" Value="1"/>
			<Cell CellID="F_62" Value=""/>
			<Cell CellID="I_62" Value=""/>
			<Cell CellID="C_37" Value=""/>
			<Cell CellID="C_46" Value=""/>
		</Cells>
	</Section>
</Sections>
