<!-- edited with XML Spy v4.1 U (http://www.xmlspy.com) by CMCSoft-->
<!DOCTYPE Sections SYSTEM "Schema.dtd">
<Sections>
	<Section Dynamic="0" MaxRows="0">
		<Cells>
			<Cell CellID="J_4" Value=""/>
			<Cell CellID="J_5" Value=""/>
			<Cell CellID="J_6" Value=""/>
			<Cell CellID="J_7" Value=""/>
			<Cell CellID="T_7" Value=""/>
			<Cell CellID="AC_7" Value=""/>
			<Cell CellID="I_10" Value=""/>
			<Cell CellID="I_12" Value=""/>
			<Cell CellID="T_12" Value=""/>
			<Cell CellID="AC_12" Value=""/>
			<Cell CellID="T_10" Value="" MaxLen="20"/>
			<Cell CellID="AC_16" Value="" MinValue="0" MaxValue="9999999999"/>
			<Cell CellID="I_14" Value=""/>
			<Cell CellID="T_14" Value="" MaxLen="100"/>
			<Cell CellID="AC_10" Value="" MaxLen="60"/>
		</Cells>
	</Section>
	<Section Dynamic="0" MaxRows="0">
		<Cells>
			<Cell CellID="M_17" Value="" MCT="1"/>
			<Cell CellID="W_28" Value="256666666" MCT="3"/>
			<Cell CellID="AB_28" Value="166545454.00" MCT="4"/>
			<Cell CellID="AG_28" Value="0" MCT="5"/>
			<Cell CellID="AJ_28" Value="0" MCT="6"/>
			<Cell CellID="AN_28" Value="90121212" MCT="7"/>
		</Cells>
	</Section>
	<Section Dynamic="1" MaxRows="0">
		<Cells>
			<Cell CellID="D_31" FirstCell="0" Value="10103" MCT="8"/>
			<Cell CellID="O_31" Value="Lít" MCT="9"/>
			<Cell CellID="R_31" Value="8.00" MCT="10"/>
			<Cell CellID="W_31" Value="200000000" MCT="11"/>
			<Cell CellID="AB_31" Value="121212121.00" MCT="12"/>
			<Cell CellID="AD_31" Value="65.0" MCT="13"/>
			<Cell CellID="AG_31" Value="0" MCT="14"/>
			<Cell CellID="AJ_31" Value="0" MCT="15"/>
			<Cell CellID="AN_31" Value="78787879" MCT="16"/>
		</Cells>
		<Cells>
			<Cell CellID="D_32" FirstCell="1" Value="10203" MCT="8"/>
			<Cell CellID="O_32" Value="Lít" MCT="9"/>
			<Cell CellID="R_32" Value="5666.00" MCT="10"/>
			<Cell CellID="W_32" Value="56666666" MCT="11"/>
			<Cell CellID="AB_32" Value="45333333.00" MCT="12"/>
			<Cell CellID="AD_32" Value="25.0" MCT="13"/>
			<Cell CellID="AG_32" Value="0" MCT="14"/>
			<Cell CellID="AJ_32" Value="0" MCT="15"/>
			<Cell CellID="AN_32" Value="11333333" MCT="16"/>
		</Cells>
	</Section>
	<Section Dynamic="0" MaxRows="0">
		<Cells>
			<Cell CellID="W_34" Value="800000" MCT="17"/>
			<Cell CellID="AB_34" Value="615385.00" MCT="18"/>
			<Cell CellID="AG_34" Value="0" MCT="19"/>
			<Cell CellID="AJ_34" Value="0" MCT="20"/>
			<Cell CellID="AN_34" Value="184616" MCT="21"/>
		</Cells>
	</Section>
	<Section Dynamic="1" MaxRows="0">
		<Cells>
			<Cell CellID="D_36" FirstCell="0" Value="20102" MCT="22"/>
			<Cell CellID="O_36" Value="gio'" MCT="23"/>
			<Cell CellID="R_36" Value="800.00" MCT="24"/>
			<Cell CellID="W_36" Value="800000" MCT="25"/>
			<Cell CellID="AB_36" Value="615385.00" MCT="26"/>
			<Cell CellID="AD_36" Value="30.0" MCT="27"/>
			<Cell CellID="AG_36" Value="0" MCT="28"/>
			<Cell CellID="AJ_36" Value="0" MCT="29"/>
			<Cell CellID="AN_36" Value="184616" MCT="30"/>
		</Cells>
	</Section>
	<Section Dynamic="0" MaxRows="0">
		<Cells>
			<Cell CellID="W_38" Value="42307876" MCT="31"/>
		</Cells>
	</Section>
	<Section Dynamic="1" MaxRows="0">
		<Cells>
			<Cell CellID="D_42" FirstCell="0" Value="10102" MCT="32"/>
			<Cell CellID="O_42" Value="Bao" MCT="33"/>
			<Cell CellID="R_42" Value="6666.00" MCT="34"/>
			<Cell CellID="W_42" Value="45555" MCT="35"/>
		</Cells>
		<Cells>
			<Cell CellID="D_43" FirstCell="1" Value="10200" MCT="32"/>
			<Cell CellID="O_43" Value="Lít" MCT="33"/>
			<Cell CellID="R_43" Value="4555.00" MCT="34"/>
			<Cell CellID="W_43" Value="4455555" MCT="35"/>
		</Cells>
	</Section>
	<Section Dynamic="1" MaxRows="0">
		<Cells>
			<Cell CellID="D_47" FirstCell="0" Value="10200" MCT="36"/>
			<Cell CellID="O_47" Value="Lít" MCT="37"/>
			<Cell CellID="R_47" Value="34.00" MCT="38"/>
			<Cell CellID="W_47" Value="3455555" MCT="39"/>
		</Cells>
		<Cells>
			<Cell CellID="D_48" FirstCell="1" Value="10203" MCT="36"/>
			<Cell CellID="O_48" Value="Lít" MCT="37"/>
			<Cell CellID="R_48" Value="34444.00" MCT="38"/>
			<Cell CellID="W_48" Value="34343434" MCT="39"/>
		</Cells>
	</Section>
	<Section Dynamic="1" MaxRows="0">
		<Cells>
			<Cell CellID="D_52" FirstCell="0" Value="10200" MCT="40"/>
			<Cell CellID="O_52" Value="Lít" MCT="41"/>
			<Cell CellID="R_52" Value="35666666.00" MCT="42"/>
			<Cell CellID="W_52" Value="7777" MCT="43"/>
		</Cells>
	</Section>
	<Section Dynamic="0" MaxRows="0">
		<Cells>
			<Cell CellID="W_54" Value="299774542" MCT="44"/>
			<Cell CellID="AB_54" Value="167160839.00" MCT="45"/>
			<Cell CellID="AG_54" Value="0" MCT="46"/>
			<Cell CellID="AJ_54" Value="0" MCT="47"/>
			<Cell CellID="AN_54" Value="90305828" MCT="48"/>
		</Cells>
	</Section>
</Sections>
